budget;genres;homepage;id;keywords;original_language;original_title;overview;popularity;production_companies;production_countries;release_date;revenue;runtime;spoken_languages;status;tagline;title;vote_average;vote_count
190000000;"[{""id"": 28, ""name"": ""Action""}]";http://www.furious7.com/;168259;"[{""id"": 830, ""name"": ""car race""}, {""id"": 3428, ""name"": ""speed""}, {""id"": 9748, ""name"": ""revenge""}, {""id"": 9937, ""name"": ""suspense""}, {""id"": 33885, ""name"": ""car""}, {""id"": 40870, ""name"": ""race""}, {""id"": 205399, ""name"": ""muscle car""}]";en;Furious 7;Deckard Shaw seeks revenge against Dominic Toretto and his family for his comatose brother.;102.322217;"[{""name"": ""Universal Pictures"", ""id"": 33}, {""name"": ""Original Film"", ""id"": 333}, {""name"": ""Fuji Television Network"", ""id"": 3341}, {""name"": ""Dentsu"", ""id"": 6452}, {""name"": ""One Race Films"", ""id"": 7154}, {""name"": ""China Film Co."", ""id"": 40890}, {""name"": ""Qu\u00e9bec Production Services Tax Credit"", ""id"": 86352}, {""name"": ""Media Rights Capital (MRC)"", ""id"": 86655}, {""name"": ""Abu Dhabi Film Commission"", ""id"": 87857}, {""name"": ""Colorado Office of Film, Television & Media"", ""id"": 87858}]";"[{""iso_3166_1"": ""JP"", ""name"": ""Japan""}, {""iso_3166_1"": ""US"", ""name"": ""United States of America""}]";2015-04-01;1506249360;137;"[{""iso_639_1"": ""en"", ""name"": ""English""}]";Released;Vengeance Hits Home;Furious 7;7.3;4176
200000000;"[{""id"": 16, ""name"": ""Animation""}, {""id"": 10751, ""name"": ""Family""}, {""id"": 12, ""name"": ""Adventure""}, {""id"": 35, ""name"": ""Comedy""}]";http://www.disney.go.com/cars/;49013;"[{""id"": 830, ""name"": ""car race""}, {""id"": 9663, ""name"": ""sequel""}, {""id"": 10267, ""name"": ""comedy""}, {""id"": 11500, ""name"": ""anthropomorphism""}, {""id"": 12392, ""name"": ""best friend""}, {""id"": 179431, ""name"": ""duringcreditsstinger""}]";en;Cars 2;Star race car Lightning McQueen and his pal Mater head overseas to compete in the World Grand Prix race. But the road to the championship becomes rocky as Mater gets caught up in an intriguing adventure of his own: international espionage.;49.98659;"[{""name"": ""Walt Disney Pictures"", ""id"": 2}, {""name"": ""Pixar Animation Studios"", ""id"": 3}]";"[{""iso_3166_1"": ""US"", ""name"": ""United States of America""}]";2011-06-11;559852396;106;"[{""iso_639_1"": ""en"", ""name"": ""English""}, {""iso_639_1"": ""ja"", ""name"": ""\u65e5\u672c\u8a9e""}, {""iso_639_1"": ""it"", ""name"": ""Italiano""}, {""iso_639_1"": ""fr"", ""name"": ""Fran\u00e7ais""}]";Released;Ka-ciao!;Cars 2;5.8;2033
170000000;"[{""id"": 28, ""name"": ""Action""}, {""id"": 878, ""name"": ""Science Fiction""}, {""id"": 12, ""name"": ""Adventure""}]";http://marvel.com/guardians;118340;"[{""id"": 8828, ""name"": ""marvel comic""}, {""id"": 9831, ""name"": ""spaceship""}, {""id"": 9882, ""name"": ""space""}, {""id"": 12405, ""name"": ""outer space""}, {""id"": 13014, ""name"": ""orphan""}, {""id"": 175428, ""name"": ""adventurer""}, {""id"": 179430, ""name"": ""aftercreditsstinger""}, {""id"": 179431, ""name"": ""duringcreditsstinger""}, {""id"": 180547, ""name"": ""marvel cinematic universe""}]";en;Guardians of the Galaxy;Light years from Earth, 26 years after being abducted, Peter Quill finds himself the prime target of a manhunt after discovering an orb wanted by Ronan the Accuser.;481.098624;"[{""name"": ""Marvel Studios"", ""id"": 420}, {""name"": ""Moving Picture Company (MPC)"", ""id"": 20478}, {""name"": ""Bulletproof Cupid"", ""id"": 54850}, {""name"": ""Revolution Sun Studios"", ""id"": 76043}]";"[{""iso_3166_1"": ""GB"", ""name"": ""United Kingdom""}, {""iso_3166_1"": ""US"", ""name"": ""United States of America""}]";2014-07-30;773328629;121;"[{""iso_639_1"": ""en"", ""name"": ""English""}]";Released;All heroes start somewhere.;Guardians of the Galaxy;7.9;9742
145000000;"[{""id"": 28, ""name"": ""Action""}, {""id"": 12, ""name"": ""Adventure""}, {""id"": 16, ""name"": ""Animation""}, {""id"": 35, ""name"": ""Comedy""}, {""id"": 10751, ""name"": ""Family""}]";http://www.kungfupanda.com/;140300;"[{""id"": 478, ""name"": ""china""}, {""id"": 779, ""name"": ""martial arts""}, {""id"": 780, ""name"": ""kung fu""}, {""id"": 5331, ""name"": ""village""}, {""id"": 8531, ""name"": ""panda""}, {""id"": 9663, ""name"": ""sequel""}, {""id"": 11477, ""name"": ""talking animal""}, {""id"": 11500, ""name"": ""anthropomorphism""}, {""id"": 12554, ""name"": ""dragon""}, {""id"": 15036, ""name"": ""ancient china""}, {""id"": 184656, ""name"": ""wuxia""}, {""id"": 187056, ""name"": ""woman director""}]";en;Kung Fu Panda 3;"Continuing his ""legendary adventures of awesomeness"", Po must face two hugely epic, but different threats: one supernatural and the other a little closer to his home.";56.747978;"[{""name"": ""Twentieth Century Fox Film Corporation"", ""id"": 306}, {""name"": ""DreamWorks Animation"", ""id"": 521}, {""name"": ""China Film Co."", ""id"": 40890}, {""name"": ""Oriental DreamWorks"", ""id"": 76266}]";"[{""iso_3166_1"": ""CN"", ""name"": ""China""}, {""iso_3166_1"": ""US"", ""name"": ""United States of America""}]";2016-01-23;521170825;95;"[{""iso_639_1"": ""en"", ""name"": ""English""}]";Released;Grab destiny by the rice dumplings.;Kung Fu Panda 3;6.7;1603
250000000;"[{""id"": 28, ""name"": ""Action""}, {""id"": 80, ""name"": ""Crime""}, {""id"": 18, ""name"": ""Drama""}, {""id"": 53, ""name"": ""Thriller""}]";http://www.thedarkknightrises.com/;49026;"[{""id"": 849, ""name"": ""dc comics""}, {""id"": 853, ""name"": ""crime fighter""}, {""id"": 949, ""name"": ""terrorist""}, {""id"": 1308, ""name"": ""secret identity""}, {""id"": 1437, ""name"": ""burglar""}, {""id"": 3051, ""name"": ""hostage drama""}, {""id"": 3562, ""name"": ""time bomb""}, {""id"": 6969, ""name"": ""gotham city""}, {""id"": 7002, ""name"": ""vigilante""}, {""id"": 9665, ""name"": ""cover-up""}, {""id"": 9715, ""name"": ""superhero""}, {""id"": 9990, ""name"": ""villainess""}, {""id"": 10044, ""name"": ""tragic hero""}, {""id"": 13015, ""name"": ""terrorism""}, {""id"": 14796, ""name"": ""destruction""}, {""id"": 18933, ""name"": ""catwoman""}, {""id"": 156082, ""name"": ""cat burglar""}, {""id"": 156395, ""name"": ""imax""}, {""id"": 173272, ""name"": ""flood""}, {""id"": 179093, ""name"": ""criminal underworld""}, {""id"": 230775, ""name"": ""batman""}]";en;The Dark Knight Rises;Following the death of District Attorney Harvey Dent, Batman assumes responsibility for Dent's crimes to protect the late attorney's reputation and is subsequently hunted by the Gotham City Police Department. Eight years later, Batman encounters the mysterious Selina Kyle and the villainous Bane, a new terrorist leader who overwhelms Gotham's finest. The Dark Knight resurfaces to protect a city that has branded him an enemy.;112.31295;"[{""name"": ""Legendary Pictures"", ""id"": 923}, {""name"": ""Warner Bros."", ""id"": 6194}, {""name"": ""DC Entertainment"", ""id"": 9993}, {""name"": ""Syncopy"", ""id"": 9996}]";"[{""iso_3166_1"": ""US"", ""name"": ""United States of America""}]";2012-07-16;1084939099;165;"[{""iso_639_1"": ""en"", ""name"": ""English""}]";Released;The Legend Ends;The Dark Knight Rises;7.6;9106
260000000;"[{""id"": 28, ""name"": ""Action""}, {""id"": 12, ""name"": ""Adventure""}, {""id"": 878, ""name"": ""Science Fiction""}]";http://movies.disney.com/john-carter;49529;"[{""id"": 818, ""name"": ""based on novel""}, {""id"": 839, ""name"": ""mars""}, {""id"": 1456, ""name"": ""medallion""}, {""id"": 3801, ""name"": ""space travel""}, {""id"": 7376, ""name"": ""princess""}, {""id"": 9951, ""name"": ""alien""}, {""id"": 10028, ""name"": ""steampunk""}, {""id"": 10539, ""name"": ""martian""}, {""id"": 10685, ""name"": ""escape""}, {""id"": 161511, ""name"": ""edgar rice burroughs""}, {""id"": 163252, ""name"": ""alien race""}, {""id"": 179102, ""name"": ""superhuman strength""}, {""id"": 190320, ""name"": ""mars civilization""}, {""id"": 195446, ""name"": ""sword and planet""}, {""id"": 207928, ""name"": ""19th century""}, {""id"": 209714, ""name"": ""3d""}]";en;John Carter;John Carter is a war-weary, former military captain who's inexplicably transported to the mysterious and exotic planet of Barsoom (Mars) and reluctantly becomes embroiled in an epic conflict. It's a world on the brink of collapse, and Carter rediscovers his humanity when he realizes the survival of Barsoom and its people rests in his hands.;43.926995;"[{""name"": ""Walt Disney Pictures"", ""id"": 2}]";"[{""iso_3166_1"": ""US"", ""name"": ""United States of America""}]";2012-03-07;284139100;132;"[{""iso_639_1"": ""en"", ""name"": ""English""}]";Released;Lost in our world, found in another.;John Carter;6.1;2124